{
  "schema_version": "1.0",
  "name": "cli-creator",
  "version": "0.1.4",
  "job_to_be_done": "Help an agent design, scaffold, refactor, package, or audit Python CLI tools and CLI-related skills with concrete workflows, packaging checks, and review-ready output contracts.",
  "skill_path": "skills/cli-creator/SKILL.md",
  "required_output_sections": [
    "Findings",
    "Scores",
    "Repair Order",
    "Test Gaps",
    "Verification Commands"
  ],
  "trigger_surface": {
    "should_trigger": [
      "帮我从零设计一个 Python CLI，并给出 packaging 方案。",
      "审查这个 Typer CLI 的 packaging 和 UX。"
    ],
    "should_not_trigger": [
      "起草一封发给客户的邮件。",
      "查询今天上海天气。"
    ],
    "edge_cases": [
      "这个 CLI skill 模板的安装命令和 wheel 内容靠谱吗？"
    ]
  },
  "workflow": {
    "steps": [
      {
        "id": "learn",
        "title": "Read SKILL.md and the named references before acting",
        "outcome": "The agent is grounded in the review rubric, pitfalls, and creation playbook."
      },
      {
        "id": "shape",
        "title": "Classify the CLI type and decide the minimum viable architecture",
        "outcome": "The command surface and architecture stay small but durable."
      },
      {
        "id": "verify",
        "title": "Verify installability, help output, packaging metadata, and skill output contract",
        "outcome": "The resulting CLI or skill is testable, installable, and reviewable."
      }
    ]
  },
  "resources": {
    "references": [
      "skills/cli-creator/references/creation-playbook.md",
      "skills/cli-creator/references/pitfalls-and-solutions.md",
      "skills/cli-creator/references/review-rubric.md",
      "skills/cli-creator/references/technical-best-practices.md"
    ],
    "scripts": [
      "scripts/cli_creator_review_gate.py"
    ],
    "reports": [
      "reports/skill_overview.md",
      "reports/output_eval_scorecard.md",
      "reports/package_verification.md",
      "reports/trust_report.md"
    ]
  },
  "eval_plan": {
    "trigger": "evals/trigger_cases.json",
    "output": "evals/output_cases.json"
  },
  "risk": {
    "output_risk": "Review answers can look polished while silently omitting required headings or packaging verification evidence.",
    "execution_risk": "Installer and package checks can drift from the published wheel if force-include or script metadata changes.",
    "trust_boundary": "The skill copies packaged local files into the user's skill directory and must not ship missing references or leaked secrets."
  },
  "governance": {
    "owner": "yjw",
    "maturity": "alpha",
    "review_cadence": "per-release"
  },
  "registry_package": "registry/package.json"
}
